id,type,created,lat,lon,no_sighted,comment,recent
0,Orca,2024-08-28 09:15:00-07:00,47.6205,-122.3493,2,Whale breaching near ferry,1
0,Orca,2024-08-28 09:45:00-07:00,47.6694,-122.3866,2,Spotted heading north,1
1,Orca,2024-08-28 10:30:00-07:00,47.7511,-122.4092,3,Pod spotted near Edmonds,1
1,Orca,2024-08-28 12:00:00-07:00,47.8574,-122.5170,3,Same pod seen near Everett,1
2,Humpback,2024-08-28 11:00:00-07:00,48.0688,-122.7644,1,Lone whale near Whidbey Island,1
3,Orca,2024-08-28 11:45:00-07:00,48.1239,-122.7607,4,Larger pod moving west,1
3,Orca,2024-08-28 12:30:00-07:00,48.2782,-122.6676,4,Heading towards San Juan Islands,1
4,Gray Whale,2024-08-28 13:00:00-07:00,47.6235,-122.3307,1,Near Seattle waterfront,1

